staff_no,name,summary,scopus_id,google_scholar,num_articles,num_proceedings,num_books,num_chapters,articles,proceedings,books,chapters,profile,img_url,total_words,quality_tier,email,profile_url
1218,Dr Muhammad Asyraf bin Khairuddin,"Muhammad Asyraf Bin Khairuddin is currently working as a lecturer at Faculty of Computer Science and Information Technology in Universiti Malaysia Sarawak (UNIMAS). He received BSc and MSc of Computer Science degrees from Universiti Teknologi Malaysia, Johor, Malaysia in 2003 and 2007 respectively. His research interests include security in requirement engineering and requirement elicitation.",55054085400,https://scholar.google.com/citations?user=W-AR_ssAAAAJ&hl=en&oi=ao,19,5,1,0,"Secure Agent-Oriented Modelling with Web-based Security Application Development; Bush Fire Simulation through Emotion-based BDI Methodology; eAOM: Extended agent-oriented modeling as an alternative methodology for blockchain enabling application development; Value-based Modeling and Simulation for Sustainable ICT4D; Sustainability Analysis of Bintulu Hospital Information System Through e3value and i* Modeling; CATALOGUE-BASED GUIDELINE FOR MISUSE CASE; Developing Fire Evacuation Simulation Through Emotion-based BDI Methodology; How to Model an Engaging
Online Quiz? The Emotion Modeling
Approach; A Multi-Agent Simulation Evacuation Model Using The Social Force Model: A Large Room Simulation Study; Developing fire evacuation simulation through BDIbased modelling and simulation; Autonomous agents in 3d crowd simulation through bdi architecture; Agent-Oriented Modelling for Blockchain Application Development: Feasibility Study; A Preliminary Work On Agent-Oriented Modelling For Mobile Argument Reality Application Development; Assessing Financial Sustainability of Community Network Project through e3value Modelling and Simulation; Financial sustainability of mobile technology deployment for rural community through e3value methodology; Modeling emotion oriented approach through agent-oriented approach; Agent Oriented Methodology for Crime Modelling and Simulation; Understanding Technology Changes for ICT4D Projects through Modelling; Integrate cultures and beliefs into genealogy software for remote communities in Borneo","Strengthening Curriculum Sructure of Software Engineering Programme; From A Shared Single Display Application to Shared Virtual Space Learning Application; Unsupervised segmentation of action segments in egocentric videos using gaze; Mit, E., Borhan, N. H. Khairuddin, M.A., (2012). Need Analysis of Culture-Based genealogy Software for Indigenous Communities,In the proceedings of

the 2012 IEEE Symposium on e-Learning, e-Management and e-Services 2012, Kuala Lumpur.; Mit, E., Cheah, W.S., Khairuddin, M.A., Borhan, N. H. (2011). Integrate Cultures and Beliefs into Genealogy for Remote Communities in Borneo, In the proceedings of the 2nd International Conference on User Science and Engineering (i-USEr 2011) , Kuala Lumpur.",Jenayah Digital: Daripada Penyelidikan kepada Penyelesaian,,"Muhammad Asyraf Bin Khairuddin is currently working as a lecturer at Faculty of Computer Science and Information Technology in Universiti Malaysia Sarawak (UNIMAS). He received BSc and MSc of Computer Science degrees from Universiti Teknologi Malaysia, Johor, Malaysia in 2003 and 2007 respectively. His research interests include security in requirement engineering and requirement elicitation. Muhammad Asyraf Bin Khairuddin is currently working as a lecturer at Faculty of Computer Science and Information Technology in Universiti Malaysia Sarawak (UNIMAS). He received BSc and MSc of Computer Science degrees from Universiti Teknologi Malaysia, Johor, Malaysia in 2003 and 2007 respectively. His research interests include security in requirement engineering and requirement elicitation. Secure Agent-Oriented Modelling with Web-based Security Application Development; Bush Fire Simulation through Emotion-based BDI Methodology; eAOM: Extended agent-oriented modeling as an alternative methodology for blockchain enabling application development; Value-based Modeling and Simulation for Sustainable ICT4D; Sustainability Analysis of Bintulu Hospital Information System Through e3value and i* Modeling; CATALOGUE-BASED GUIDELINE FOR MISUSE CASE; Developing Fire Evacuation Simulation Through Emotion-based BDI Methodology; How to Model an Engaging Online Quiz? The Emotion Modeling Approac Strengthening Curriculum Sructure of Software Engineering Programme; From A Shared Single Display Application to Shared Virtual Space Learning Application; Unsupervised segmentation of action segments in egocentric videos using gaze; Mit, E., Borhan, N. H. Khairuddin, M.A., (2012). Need Analysis of Culture-Based genealogy Software for Indigenous Communities,In the proceedings of the 2012 IEEE Symposium on e-Learning, e-Management and e-Services 2012, Kuala Lumpur.; Mit, E., Cheah, W.S., Khairuddin, M.A., Borhan, N. H. (2011). Integrate Cultures and Beliefs into Genealogy for Remote Communities",https://directory.unimas.my/assets/images/staffpic/1218.jpg,259,MODERATE,kmasyraf@unimas.my,https://expert.unimas.my/profile/1218
K0788,Profesor Dr. Narayanan A/L N Kulathu Ramaiyer,"Professor Dr. Narayanan Kulathuramaiyer has served 24 years of his almost three decades in academia as one of the pioneer staff of Faculty of Computer Science and IT in UNIMAS. He is currently the Director of the Institute of Social Informatics and Technological Innovations (ISITI) and Professor of Computer Science at the Faculty of Computer Science and Information Technology, Universiti Malaysia Sarawak (UNIMAS).  He received his Ph.D. in Computer Science from Graz University of Technology, Austria. 
He has completed supervision of 6 PhD and 14 Masters candidates. He has taught over 20 courses at the Undergraduate and Masters level.
In terms of research, he has published around 120 peer-reviewed papers on technology-based learning, data analytics and on making eLearning work in an information proliferation era.  He has a H-Index of 12, according to Google Scholar.  
He has pioneered efforts in eLearning from heading the Virtual Campus Programme, Centre of Applied Learning and Multimedia, and initiating UNIMAS' first ever MOOC initiative on IT literacy. He is continuing to impact changes at the national and international levels through his work with remote rural communities across the country, strategy shaping Taskforce on ICT education, promoting MOOC and currently innovating MOOC technology to serve marginalized rural communities in Malaysia, Indonesia and Philippines. 
 He has been instrumental in the Virtual Campus project and online learning efforts in UNIMAS and has produced blueprints for eLearning for UNIMAS in 2001. At the national level he had also been a member of the National IT Council’s (NITC) Strategic Taskforce on eLearning from 2000-2001. 
Furthermore he has obtained registered Intellectual Property and the National and International awards for his role in projects such as eBario project and the e-Toro Indigenous Knowledge Management system, Semantic Clustering Toolkit and the e-Co Outcome-based profiling system. In his official portfolio as Directo",18042275000,https://scholar.google.com/citations?user=wjNXvWwAAAAJ&hl=en,35,15,1,2,"Strengthening the absorptive capacity of the national innovation system through university-industry research collaboration: A Theory of Inventive Problem Solving approach; Mitigating the Evidence-Related Factors in Automated Fact-Checking; Explainable Evidence-Based Veracity Assessment of Textual Claim; TRIZ-Based Approach in Remodeling Invasive Glucometer; Intellectual Capital: A System Thinking Analysis in Revamping the Exchanging Information in University-Industry Research Collaboration; Cultural Resilience in the Face of globalization: Lessons from the Penan of Borneo; Mathematical Modelling and Formalization of TRIZ: Trimming for Product Design; Blended system thinking approach to strengthen the education and training in university-industry research collaboration; Preserving Cultural Knowledge through Community-Led MOOCs; Contextualizing Learning for Rural Community using Library-in-a-Box: Experience from Penan Community; Community Engagement to Gender Differentiated Impacts of Climate Change in Social Media; The indirect and intangible impacts of a telecentre on a rural community; Performance of Opinion Summarization towards Extractive Summarization; Modelling indigenous knowledge creation as a living system; True value of telecentre contribution to Bario community development; A systematic mapping study of database resources to ontology via reverse engineering; Modelling indigenous knowledge creation as a living system.; ""Fully Automatic Detections of Abnormalities of Brain MR Images by utilizing Spatial Information and Mathematical Morphological Operators"".; Inducing a semantically rich nested event model; Wiki SaGa: An interactive timeline to visualize historical documents; A survey of communications and collaborative web technologies; Linguistically Enhanced Collocate Words Model; Event lexical database: A semantic role labeling approach; Nested event model; Enhancement of Magnetic Resonance Images Using Soft Computing Based Segmentation; Towards Resolving Software Quality-in-Use Measurement Challenges; Indigenous Knowledge Management in the Kelabit community in Eastern Malaysia: insights and reflections for contemporary KM design.; Towards Semantic Clustering: Grouping Image Visual Features Through Exploratory Factor Analysis; Towards Semantic Clustering–A Brief Overview; Improving citation mining; Isolation and characterization of culturable bacteria from tropical coastal waters [Aislamiento y caracterizaciÃ³n de bacterias cultivables de aguas costeras tropicales]; Integrated multimodal copy-paste checking; Knowledge gathering as it changes with new technologies; Feature Selection Based on Semantics; Applications of mash-ups for a digital journal",PIONEERING BORNEO TRIZ AND FURTHER PROLIFERATE KNOWLEDGE WITH REMOTE LOCATIONS; TRIZ-Based Remodeling of Body Enclosure for Corpse; TRIZ-Based Approach in Co-creating Virtual Story-Maps; Inventive Design Solutions for the Complex Socio-technical Problems in Preserving Indigenous Symbolic Visual Communication; TRIZ-Based Remodeling of Multiple True-False Questions; Towards a framework for modelling innovative expressions; TRIZ for Shaping Life-Long Learning; Developing an Indigenous Cultural Values Based Emoji Messaging System: A Socio-Technical Systems Innovation Approach; A Comparative Study of Sentiment-Based Graphs of Text Summaries; Addressing Societal Issues Through MOOCs in Southeast Asia; The eBario Story: ICTs for Rural Development; Modelling Telecentre as Community Learning Centre For Youths Using Triz; Riding waves of change: A review of personas research landscape based on the three waves of HCI; EFA for structure detection in image data empirical results on two datasets of different perspective; Semantic feature selection using WordNet,Murum Handicraft,TRIZ-Based Approach in Capturing and Managing Indigenous Innovation and Knowledge; Towards Participatory MOOCs,"Professor Dr. Narayanan Kulathuramaiyer has served 24 years of his almost three decades in academia as one of the pioneer staff of Faculty of Computer Science and IT in UNIMAS. He is currently the Director of the Institute of Social Informatics and Technological Innovations (ISITI) and Professor of Computer Science at the Faculty of Computer Science and Information Technology, Universiti Malaysia Sarawak (UNIMAS). He received his Ph.D. in Computer Science from Graz University of Technology, Austria. He has completed supervision of 6 PhD and 14 Masters candidates. He has taught over 20 courses at the Undergraduate and Masters level. In terms of research, he has published around 120 peer-reviewed papers on technology-based learning, data analytics and on making eLearning work in an information proliferation era. He has a H-Index of 12, according to Google Scholar. He has pioneered efforts in eLearning from heading the Virtual Campus Programme, Centre of Applied Learning and Multimedia, and initiating UNIMAS' first ever MOOC initiative on IT literacy. He is continuing to impact changes at the national and international levels through his work with remote rural communities across the country, strategy shaping Taskforce on ICT education, promoting MOOC and currently innovating MOOC technology to serve marginalized rural communities in Malaysia, Indonesia and Philippines. He has been instrumental in the Virtual Campus project and online learning efforts in UNIMAS and has produced blueprints for eLearning for UNIMAS in 2001. At the national level he had also been a member of the National IT Council’s (NITC) Strategic Taskforce on eLearning from 2000-2001. Furthermore he has obtained registered Intellectual Property and the National and International awards for his role in projects such as eBario project and the e-Toro Indigenous Knowledge Management system, Semantic Clustering Toolkit and the e-Co Outcome-based profiling system. In his official portfolio as Directo Professor Dr. Narayanan Kulathuramaiyer has served 24 years of his almost three decades in academia as one of the pioneer staff of Faculty of Computer Science and IT in UNIMAS. He is currently the Director of the Institute of Social Informatics and Technological Innovations (ISITI) and Professor of Computer Science at the Faculty of Computer Science and Information Technology, Universiti Malaysia Sarawak (UNIMAS). He received his Ph.D. in Computer Science from Graz University of Technology, Austria. He has completed supervision of 6 PhD and 14 Masters candidates. He has taught over 20 courses at the Undergraduate and Masters level. In terms of research, he has published around 120 peer-reviewed papers on technology-based learning, data analytics and on making eLearning work in an information proliferation era. He has a H-Index of 12, according to Google Scholar. He has pioneered efforts in eLearning from heading the Virtual Campus Programme, Centre of Applied Learning and Multimedia, and initiating UNIMAS' first ever MOOC initiative on IT literacy. He is continuing to impact changes at the national and international levels through his work with remote rural communities across the country, strategy shaping Taskforce on ICT education, promoting MOOC and currently innovating MOOC technology to serve marginalized rural communities in Malaysia, Indonesia and Philippines. He has been instrumental in the Virtual Campus project and online learning efforts in UNIMAS and has produced blueprints for eLearning for UNIMAS in 2001. At the national level he had also been a member of the National IT Council’s (NITC) Strategic Taskforce on eLearning from 2000-2001. Furthermore he has obtained registered Intellectual Property and the National and International awards for his role in projects such as eBario project and the e-Toro Indigenous Knowledge Management system, Semantic Clustering Toolkit and the e-Co Outcome-based profiling system. In his official portfolio as Directo Strengthening the absorptive capacity of the national innovation system through university-industry research collaboration: A Theory of Inventive Problem Solving approach; Mitigating the Evidence-Related Factors in Automated Fact-Checking; Explainable Evidence-Based Veracity Assessment of Textual Claim; TRIZ-Based Approach in Remodeling Invasive Glucometer; Intellectual Capital: A System Thinking Analysis in Revamping the Exchanging Information in University-Industry Research Collaboration; Cultural Resilience in the Face of globalization: Lessons from the Penan of Borneo; Mathematical Modelli PIONEERING BORNEO TRIZ AND FURTHER PROLIFERATE KNOWLEDGE WITH REMOTE LOCATIONS; TRIZ-Based Remodeling of Body Enclosure for Corpse; TRIZ-Based Approach in Co-creating Virtual Story-Maps; Inventive Design Solutions for the Complex Socio-technical Problems in Preserving Indigenous Symbolic Visual Communication; TRIZ-Based Remodeling of Multiple True-False Questions; Towards a framework for modelling innovative expressions; TRIZ for Shaping Life-Long Learning; Developing an Indigenous Cultural Values Based Emoji Messaging System: A Socio-Technical Systems Innovation Approach; A Comparative Study ",https://directory.unimas.my/assets/images/staffpic/K0788.jpg,740,RICH,nara@unimas.my,https://expert.unimas.my/profile/K0788
368,Profesor Madya Dr. Noor Alamshah B. Bolhassan,"Dr Noor Alamshah Bin Bolhassan is presently working as an associate professor at Faculty of Computer Science and Information Technology (FCSIT) in Universiti Malaysia Sarawak (UNIMAS). He received his Doctor of Philosophy (PhD) from University of Aizu, Japan in 2005. He had more than 10 years’ experience in research and development (R&D). The area of interests includes spatial media, programming, and web technology.",37046061100,,5,4,0,1,"Evidence of the potential benefits of digital technology integration in Asian agronomy and forestry: A systematic review; Harvesting a sustainable future : An overview of smart agriculture's role in social, economic, and environmental sustainability; SMART GROW – Low-cost automated hydroponic system for urban farming; Branding and Commercialization of Heritage Products and Services Eco-system Framework; A Multiuser Multiperspective Stereographic QTVR Browser Complemented by Java3D Visualizer and Emulator.",A Mobile App-Based Peer Assessment for Problem-Based Learning Groups; PeerA : An App for Online Peer Assessment in Medical Problem-Based Learning Groups; The Analysis of 2D Crowd Behaviour Simulation during Emergency Situation; Case study: University lecture timetabling without pre-registration data,,Evaluating the Segment Anything Model on the Agarwood Resinous Compounds Segmentation Task,"Dr Noor Alamshah Bin Bolhassan is presently working as an associate professor at Faculty of Computer Science and Information Technology (FCSIT) in Universiti Malaysia Sarawak (UNIMAS). He received his Doctor of Philosophy (PhD) from University of Aizu, Japan in 2005. He had more than 10 years’ experience in research and development (R&D). The area of interests includes spatial media, programming, and web technology. Dr Noor Alamshah Bin Bolhassan is presently working as an associate professor at Faculty of Computer Science and Information Technology (FCSIT) in Universiti Malaysia Sarawak (UNIMAS). He received his Doctor of Philosophy (PhD) from University of Aizu, Japan in 2005. He had more than 10 years’ experience in research and development (R&D). The area of interests includes spatial media, programming, and web technology. Evidence of the potential benefits of digital technology integration in Asian agronomy and forestry: A systematic review; Harvesting a sustainable future : An overview of smart agriculture's role in social, economic, and environmental sustainability; SMART GROW – Low-cost automated hydroponic system for urban farming; Branding and Commercialization of Heritage Products and Services Eco-system Framework; A Multiuser Multiperspective Stereographic QTVR Browser Complemented by Java3D Visualizer and Emulator. A Mobile App-Based Peer Assessment for Problem-Based Learning Groups; PeerA : An App for Online Peer Assessment in Medical Problem-Based Learning Groups; The Analysis of 2D Crowd Behaviour Simulation during Emergency Situation; Case study: University lecture timetabling without pre-registration data",https://directory.unimas.my/assets/images/staffpic/368.jpg,232,MODERATE,bnalamshah@unimas.my,https://expert.unimas.my/profile/368
