staff_no,name,summary,scopus_id,google_scholar,num_articles,num_proceedings,num_books,num_chapters,articles,proceedings,books,chapters,profile,img_url,total_words,quality_tier,email,profile_url
861,Ts. Abdul Rahman bin Mat,"Abdul Rahman Bin Mat is a senior lecturer for Software Engineering programme at the Faculty of Computer Science & Information Technology, Universiti Malaysia Sarawak (UNIMAS). He received his Masters in Computer Science and Engineering in Aizu University (Japan) at year 2005. He had more than 10 years’ experience in research and development (R&D). The area of interests includes requirement analysis and specification, knowledge-based system, formal method, and software testing.",55430406700,https://scholar.google.com/citations?user=MFP6ZiUAAAAJ&hl=en,10,6,0,0,"Location-Based Service with Interactive Mapping in Food Feed Mobile App (FeatiGo); Optimising Wind Energy Capture: An IoT-Based Approach to Height Adjustment in Roadside Wind Turbines; Applying SOFL to Enhance Requirements Gathering in Educational Technology: Case Study of Developing Course Plan Assistant; Agent-based simulation with awareness levels of the emergency evacuation of educational facilities; NR-Connect: Development of UNIMAS Non-Resident Mobile Application; IoT-based Framework for Coordinating Smart
Home; Web-based Digital Agreement System for Freelancers: Case Study in Bangladesh; Team software process (TSPI) web-based support tool; Analysis of nine instance-based genetic algorithm classifiers using small datasets; A Methodology for Implementation of Service Learning in Higher Education Institution: A case study from Faculty of Computer Science and Information Technology, UNIMAS",Strengthening Curriculum Sructure of Software Engineering Programme; Silver Jubilee Conference 2017 transforming communities towards a sustainable and globalised society : abstract; Silver Jubilee Conference 2017 transforming communities towards a sustainable and globalised society : abstract; Derivation of effective guidance for specification constructions from CDFD-based knowledge representations; Temporal Property Preservation Under Z Refinement in CSP-OZ Specifications; Applying SOFL to construct requirements specification for examination monitoring system,,,"Abdul Rahman Bin Mat is a senior lecturer for Software Engineering programme at the Faculty of Computer Science & Information Technology, Universiti Malaysia Sarawak (UNIMAS). He received his Masters in Computer Science and Engineering in Aizu University (Japan) at year 2005. He had more than 10 years’ experience in research and development (R&D). The area of interests includes requirement analysis and specification, knowledge-based system, formal method, and software testing. Abdul Rahman Bin Mat is a senior lecturer for Software Engineering programme at the Faculty of Computer Science & Information Technology, Universiti Malaysia Sarawak (UNIMAS). He received his Masters in Computer Science and Engineering in Aizu University (Japan) at year 2005. He had more than 10 years’ experience in research and development (R&D). The area of interests includes requirement analysis and specification, knowledge-based system, formal method, and software testing. Location-Based Service with Interactive Mapping in Food Feed Mobile App (FeatiGo); Optimising Wind Energy Capture: An IoT-Based Approach to Height Adjustment in Roadside Wind Turbines; Applying SOFL to Enhance Requirements Gathering in Educational Technology: Case Study of Developing Course Plan Assistant; Agent-based simulation with awareness levels of the emergency evacuation of educational facilities; NR-Connect: Development of UNIMAS Non-Resident Mobile Application; IoT-based Framework for Coordinating Smart Home; Web-based Digital Agreement System for Freelancers: Case Study in Bangladesh Strengthening Curriculum Sructure of Software Engineering Programme; Silver Jubilee Conference 2017 transforming communities towards a sustainable and globalised society : abstract; Silver Jubilee Conference 2017 transforming communities towards a sustainable and globalised society : abstract; Derivation of effective guidance for specification constructions from CDFD-based knowledge representations; Temporal Property Preservation Under Z Refinement in CSP-OZ Specifications; Applying SOFL to construct requirements specification for examination monitoring system",https://directory.unimas.my/assets/images/staffpic/861.jpg,279,MODERATE,marahman@unimas.my,https://expert.unimas.my/profile/861
K0537,Prof Madya Ts Dr Adnan Shahid Khan,"Adnan Shahid Khan is currently working as Assoc. Professor at Faculty of Computer Science and Information Technology, Universiti Malaysia Sarawak. He has completed his Postdoctoral, Ph.D. and Masters in Networks in 2013, 2012, 2008 respectively from Universiti Technology Malaysia, Johor Bahru, Malaysia and BSc (Hons) Computer Sciences in 2005 from University of Punjab, Lahore Pakistan. His research interest includes Wireless Communication, Cloud computing, Internet of things, Software Defined Networking, Cryptography, Network and Information Security.",57212619973,https://scholar.google.com.my/citations?user=jVTNkL4AAAAJ&hl=en,50,12,2,0,"University Students’ Perspectives on Adopting Internet of Things Technologies in Smart Farming: An Analysis Using the Extended Technology Acceptance Model; Evaluation of SongketChain: A Framework to Protect Unique Cultural Product using Blockchain Technology; Data-Driven Agriculture: Unveiling the Power of Internet of Things and Data Analytics For Transformative Farming Practices; Strengthening the absorptive capacity of the national innovation system through university-industry research collaboration: A Theory of Inventive Problem Solving approach; Enhancing IoT security with a DNA-based lightweight cryptography system; Key Insights into Recommended SMS Spam Detection Datasets; End-to-End Security Mechanism Using Blockchain
for Industrial Internet of Things; DNA encoding schemes herald a new age in cybersecurity
for safeguarding digital assets; TPAAD: Two-phase authentication system for denial of service attack detection and mitigation using machine learning in software-defined network; TPAAD: Two-phase authentication system for denial of
service attack detection and mitigation using machine
learning in software-defined network; A lightweight and robust authentication scheme for the healthcare system using public cloud server; Augmenting the Robustness and Efficiency of Violence Detection Systems for Surveillance and Non-Surveillance Scenarios; MS-ADS: Multistage Spectrogram image-based AnomalyDetection System for IoT security; Blockchain-Based Lightweight Multifactor Authentication for Cell-Free in Ultra-Dense 6G-Based (6-CMAS) Cellular Network; A Survey on 6G Enabled Light Weight Authentication Protocol for UAVs, Security, Open Research Issues and Future Directions; A Survey on 6G Enabled Light Weight Authentication Protocol
for UAVs, Security, Open Research Issues and Future Directions; A Verifiably Secure ECC Based Authentication Scheme for Securing IoD Using FANET; Intellectual Capital: A System Thinking Analysis in Revamping the Exchanging Information in University-Industry Research Collaboration; Lightweight Multifactor Authentication Scheme for NextGen Cellular Networks; Blockchain-based Multifactor Authentication for Future 6G Cellular Networks: A Systematic Review; Analysis and Intellectual Structure of the Multi-Factor Authentication in Information Security; A comprehensive study on DNA based Security scheme Using Deep Learning in Healthcare; Anomaly Detection Using Deep Neural Network for IoT Architecture; Soft Computing and Decision Support System for Software Process Improvement: A Systematic Literature Review; A Spectrogram Image-Based Network Anomaly
Detection System Using Deep Convolutional
Neural Network; Evolutionary Integrated Heuristic with Gudermannian Neural Networks for Second Kind of Lane–Emden Nonlinear Singular Models; Trust‑based lightweight security protocol for device to device multihop cellular communication (TLwS); Blended system thinking approach to strengthen the education and training in university-industry research collaboration; A Novel Authentication and Key Agreement Scheme for Countering MITM and Impersonation Attack in Medical Facilities; Network intrusion detection system: A systematic study of machine learning and deep learning approaches; A framework for traceable and transparent supply chain management for agri-food sector in malaysia using blockchain technology; Secure trust-based blockchain architecture to prevent attacks in VANET; Systematic literature review of identifying issues in software cost estimation techniques; RSSI and Public Key Infrastructure based Secure Communication in Autonomous Vehicular Networks; A Reliable Path Selection and Packet Forwarding Routing Protocol for Vehicular Ad hoc Networks; Dynamic Multiple Junction Selection Based Routing protocol for VANETs in city environment; A review of vehicle to vehicle communication protocols for VANETs in the urban environment; Enhancement of 5G Architecture and Framework Using Green and Emerging Technology; Energy Efficient Resource Allocation and Utilization in Future Heterogeneous Cellular Network; Quantum-Elliptic curve Cryptography for Multihop Communication in 5G Networks; EEoP: A lightweight security scheme over PKI in D2D cellular networks; Preventing DoS Attacks in IoT Using AES; Security issues in 5G device to device communication; A Taxonomy Study of XSS Vulnerabilities; Threats advancement in primary user emulation attack and Spectrum Sensing Data Falsification (SSDF) attack in Cognitive Radio Network (CRN) for 5G wireless network environment; Defending malicious script attacks using machine learning classifiers; A dynamic energy savvy routing algorithm for mobile Ad-hoc and sensor networks; Secure and scalable group rekeying for mobile multihop relay network; Mitigation of non-transparent rouge relay stations in mobile multihop relay networks; A dynamic method of detecting malicious scripts using classifiers",Cognitive Architecture Based Spectrum Sharing between 4G LTE-Advanced Network and TV Band; HEADS: Hybrid Ensemble Anomaly Detection System for Internet-of-Things Networks; Songketchain: A Framework to Protect Unique Cultural Product using Blockchain Technology; Wearable Sensor Feature Fusion for Human Activity Recognition (HAR): A Proposed Classification Framework; S-ADS: Spectrogram Image-based Anomaly Detection System for IoT networks; Conceptual Review of DoS Attacks in Software Defined Networks; Employing Public Key Infrastructure to Encapsulate Messages During Transport Layer Security Handshake Procedure; A Lightweight Multifactor Authentication Scheme for Wireless Sensor Networks in the Internet of Things.; Effective way to defend the hypervisor attacks in cloud computing; Towards vulnerability prevention model for web browser using interceptor approach; Neighbor selection protocol for heterogeneous information dissemination in opportunistic networks; Neighbor Selection Protocol for Hetergeneous Information Dissemination in Opportunistic Networks,Mobile Multi hop Relay WIMAX Networks: Security Perspectives; FCSIT Research Bulletin 2016,,"Adnan Shahid Khan is currently working as Assoc. Professor at Faculty of Computer Science and Information Technology, Universiti Malaysia Sarawak. He has completed his Postdoctoral, Ph.D. and Masters in Networks in 2013, 2012, 2008 respectively from Universiti Technology Malaysia, Johor Bahru, Malaysia and BSc (Hons) Computer Sciences in 2005 from University of Punjab, Lahore Pakistan. His research interest includes Wireless Communication, Cloud computing, Internet of things, Software Defined Networking, Cryptography, Network and Information Security. Adnan Shahid Khan is currently working as Assoc. Professor at Faculty of Computer Science and Information Technology, Universiti Malaysia Sarawak. He has completed his Postdoctoral, Ph.D. and Masters in Networks in 2013, 2012, 2008 respectively from Universiti Technology Malaysia, Johor Bahru, Malaysia and BSc (Hons) Computer Sciences in 2005 from University of Punjab, Lahore Pakistan. His research interest includes Wireless Communication, Cloud computing, Internet of things, Software Defined Networking, Cryptography, Network and Information Security. University Students’ Perspectives on Adopting Internet of Things Technologies in Smart Farming: An Analysis Using the Extended Technology Acceptance Model; Evaluation of SongketChain: A Framework to Protect Unique Cultural Product using Blockchain Technology; Data-Driven Agriculture: Unveiling the Power of Internet of Things and Data Analytics For Transformative Farming Practices; Strengthening the absorptive capacity of the national innovation system through university-industry research collaboration: A Theory of Inventive Problem Solving approach; Enhancing IoT security with a DNA-based ligh Cognitive Architecture Based Spectrum Sharing between 4G LTE-Advanced Network and TV Band; HEADS: Hybrid Ensemble Anomaly Detection System for Internet-of-Things Networks; Songketchain: A Framework to Protect Unique Cultural Product using Blockchain Technology; Wearable Sensor Feature Fusion for Human Activity Recognition (HAR): A Proposed Classification Framework; S-ADS: Spectrogram Image-based Anomaly Detection System for IoT networks; Conceptual Review of DoS Attacks in Software Defined Networks; Employing Public Key Infrastructure to Encapsulate Messages During Transport Layer Security Han",https://directory.unimas.my/assets/images/staffpic/K0537.jpg,299,MODERATE,skadnan@unimas.my,https://expert.unimas.my/profile/K0537
858,Ts. Ahmad Hadinata bin Fauzi,"Ts. Hj. Ahmad Hadinata bin Fauzi is presently working as a Senior Lecturer in Network Computing Program at Faculty of Computer Science and Information Technology in Universiti Malaysia Sarawak (UNIMAS). 
He received his Master of Network Computing from Monash University(Australia) in 2006.
The area of interests includes Internet of Things(IoT), Network Security and Network Administration.",25824858400,https://scholar.google.com/citations?user=nNJ5oU4AAAAJ&hl=en,18,4,2,1,Detection of Monocrystalline Silicon Wafer Defects Using Deep Transfer Learning; Classification of Planetary Nebulae through Deep Transfer Learning; Mobile augmented reality for biology learning: Review and design recommendations; Analysis of Light Bulb Temperature Control for Egg Incubator Design; Enhancement of 5G Architecture and Framework Using Green and Emerging Technology; ParkBuddy – Find My Car Android Mobile Application; SambaKodiPi A Personal File Server and Media Center; Threats advancement in primary user emulation attack and Spectrum Sensing Data Falsification (SSDF) attack in Cognitive Radio Network (CRN) for 5G wireless network environment; A Review on Orthogonal Frequency Division Multiple Access (OFDMA) in Broadband Wireless Access; Community Trust Stores for Peer-to-Peer e-Commerce Applications Using Cloud Services; Securing a Cloud-Based Community Trust Store for Local P2P e-Commerce; Classification of Piper Nigrum Samples Using Machine Learning Techniques : A Comparison; Foreign matter identification in Piper Nigrum samples; Community Trust Stores for Peer-to-Peer e-Commerce Applications; iPepper: Intelligent pepper grading and quality assurance system; Analysis of packets abnormalities in wireless sensor network; Bluetooth mobile advertising system using pull-based approach; Mobile Agriculture Management System,Increasing Student Engagement through Authentic Learning Activities in MOOC Environment; Review and experience on developing sarawak traditional food locator mobile apps; Automated machine for sorting Sarawak pepper berries; Automated mobile-based grader for Piper Nigrum,FCSIT Research Bulletin 2017; FCSIT Research Bulletin 2016,Increasing Student Engagement through Authentic Learning Activities in MOOC Environment E-learning,"Ts. Hj. Ahmad Hadinata bin Fauzi is presently working as a Senior Lecturer in Network Computing Program at Faculty of Computer Science and Information Technology in Universiti Malaysia Sarawak (UNIMAS). He received his Master of Network Computing from Monash University(Australia) in 2006. The area of interests includes Internet of Things(IoT), Network Security and Network Administration. Ts. Hj. Ahmad Hadinata bin Fauzi is presently working as a Senior Lecturer in Network Computing Program at Faculty of Computer Science and Information Technology in Universiti Malaysia Sarawak (UNIMAS). He received his Master of Network Computing from Monash University(Australia) in 2006. The area of interests includes Internet of Things(IoT), Network Security and Network Administration. Detection of Monocrystalline Silicon Wafer Defects Using Deep Transfer Learning; Classification of Planetary Nebulae through Deep Transfer Learning; Mobile augmented reality for biology learning: Review and design recommendations; Analysis of Light Bulb Temperature Control for Egg Incubator Design; Enhancement of 5G Architecture and Framework Using Green and Emerging Technology; ParkBuddy – Find My Car Android Mobile Application; SambaKodiPi A Personal File Server and Media Center; Threats advancement in primary user emulation attack and Spectrum Sensing Data Falsification (SSDF) attack in Cog Increasing Student Engagement through Authentic Learning Activities in MOOC Environment; Review and experience on developing sarawak traditional food locator mobile apps; Automated machine for sorting Sarawak pepper berries; Automated mobile-based grader for Piper Nigrum",https://directory.unimas.my/assets/images/staffpic/858.jpg,225,MODERATE,hadinata@unimas.my,https://expert.unimas.my/profile/858
1330,Dr Amelia Jati Anak Robert Jupit,"Amelia Jupit is a senior lecturer at the Faculty of Computer Science and Information Technology at Universiti Malaysia Sarawak (UNIMAS). She earned her Bachelor's Degree in Computer Science (Hons) with a major in Multimedia Computing from UNIMAS in 2003 and a Master of Information Technology from the University of New South Wales in 2007. In 2009, she received her Postgraduate Diploma in Teaching and Learning. She completed her Ph.D. study on player's projective identity in digital games at the University of York. Her research interests include player experience, human-computer interaction, game-based learning, narrative, and identity.",55856448900,https://scholar.google.co.uk/citations?user=6SOnCPgAAAAJ&hl=en,5,10,0,1,Digital Game Design for Older Adults : A Conceptual Framework; Evaluating the Sabah Pay Mobile Application (e-Wallet) using the Technology Acceptance Model; Empowering Youth through Play : Promoting Awareness of Sexual Grooming among Schoolchildren through Game-based Learning; Does it Matter with Physical classes in Blended Learning or without in Full Online Learning for Undergraduate Programming Course in the Pandemic Situation?; AirXorcist: Raising Awareness About Air Pollution through Narrative Storytelling in Computer Game,"eMarket for Local Farmers; Boos : An android application on learning KadazanDusun for non-native KadazanDusun speakers; Older Adults and Digital Game: Trends, Challenges and Benefits; Identity of players in digital games; Automatic generation of fill-in clues and answers from raw texts for crosswords; Facial expressions reconstruction of 3D faces based on real human data; Story-telling and narrative methods with localised content to preserve knowledge; Realistic facial expression synthesis of 3D human face based on real data using multivariate tensor methods; Cross-cultural awareness in game-based learning using a TPACK approach; Preservation of Cultural Heritage through the Sarawak Language Technologies (SaLT) Initiatives: An AI Perspective",,FROM BLENDED LEARNING TO ONLINE LEARNING: A JAVA PROGRAMMING COURSE CASE STUDY,"Amelia Jupit is a senior lecturer at the Faculty of Computer Science and Information Technology at Universiti Malaysia Sarawak (UNIMAS). She earned her Bachelor's Degree in Computer Science (Hons) with a major in Multimedia Computing from UNIMAS in 2003 and a Master of Information Technology from the University of New South Wales in 2007. In 2009, she received her Postgraduate Diploma in Teaching and Learning. She completed her Ph.D. study on player's projective identity in digital games at the University of York. Her research interests include player experience, human-computer interaction, game-based learning, narrative, and identity. Amelia Jupit is a senior lecturer at the Faculty of Computer Science and Information Technology at Universiti Malaysia Sarawak (UNIMAS). She earned her Bachelor's Degree in Computer Science (Hons) with a major in Multimedia Computing from UNIMAS in 2003 and a Master of Information Technology from the University of New South Wales in 2007. In 2009, she received her Postgraduate Diploma in Teaching and Learning. She completed her Ph.D. study on player's projective identity in digital games at the University of York. Her research interests include player experience, human-computer interaction, game-based learning, narrative, and identity. Digital Game Design for Older Adults : A Conceptual Framework; Evaluating the Sabah Pay Mobile Application (e-Wallet) using the Technology Acceptance Model; Empowering Youth through Play : Promoting Awareness of Sexual Grooming among Schoolchildren through Game-based Learning; Does it Matter with Physical classes in Blended Learning or without in Full Online Learning for Undergraduate Programming Course in the Pandemic Situation?; AirXorcist: Raising Awareness About Air Pollution through Narrative Storytelling in Computer Game eMarket for Local Farmers; Boos : An android application on learning KadazanDusun for non-native KadazanDusun speakers; Older Adults and Digital Game: Trends, Challenges and Benefits; Identity of players in digital games; Automatic generation of fill-in clues and answers from raw texts for crosswords; Facial expressions reconstruction of 3D faces based on real human data; Story-telling and narrative methods with localised content to preserve knowledge; Realistic facial expression synthesis of 3D human face based on real data using multivariate tensor methods; Cross-cultural awareness in game-b",https://directory.unimas.my/assets/images/staffpic/1330.jpg,346,MODERATE,rjajati@unimas.my,https://expert.unimas.my/profile/1330
491,Dr Azman Bin Bujang Masli,"Azman Bujang Masli is presently working as a senior lecturer at Faculty of Computer Science and Information Technology in Universiti Malaysia Sarawak (UNIMAS). He received his Doctor of Philosophy (PhD) from The Sheffield University, UK in 2011. His research area interest includes software engineering, formal specification and verification.",55362426900,https://scholar.google.com.my/citations?user=UaHPx-kAAAAJ&hl=en,2,5,0,0,Team software process (TSPI) web-based support tool; Evaluating Complexity of Task Knowledge Patterns through Reusability Assessment,"Refinement in integrated specifications of CSP-OZ; Temporal Property Preservation Under Z Refinement in CSP-OZ Specifications; Applying SOFL to construct requirements specification for examination monitoring system; Masli, A. B. Mit, E., Borhan, N. H. (2011). Refinement in Integrated Formal Specifications, In the proceedings of the The 2nd International Conference on Software Engineering and Computer Systems., Pahang, Malaysia.; Systems’ Property Preservation Under Z Refinement: An application to the OZ part of CSP-OZ specifications",,,"Azman Bujang Masli is presently working as a senior lecturer at Faculty of Computer Science and Information Technology in Universiti Malaysia Sarawak (UNIMAS). He received his Doctor of Philosophy (PhD) from The Sheffield University, UK in 2011. His research area interest includes software engineering, formal specification and verification. Azman Bujang Masli is presently working as a senior lecturer at Faculty of Computer Science and Information Technology in Universiti Malaysia Sarawak (UNIMAS). He received his Doctor of Philosophy (PhD) from The Sheffield University, UK in 2011. His research area interest includes software engineering, formal specification and verification. Team software process (TSPI) web-based support tool; Evaluating Complexity of Task Knowledge Patterns through Reusability Assessment Refinement in integrated specifications of CSP-OZ; Temporal Property Preservation Under Z Refinement in CSP-OZ Specifications; Applying SOFL to construct requirements specification for examination monitoring system; Masli, A. B. Mit, E., Borhan, N. H. (2011). Refinement in Integrated Formal Specifications, In the proceedings of the The 2nd International Conference on Software Engineering and Computer Systems., Pahang, Malaysia.; Systems’ Property Preservation Under Z Refinement: An application to the OZ part of CSP-OZ specifications",https://directory.unimas.my/assets/images/staffpic/491.jpg,183,SPARSE,bmazman@unimas.my,https://expert.unimas.my/profile/491
