staff_no,name,summary,scopus_id,google_scholar,num_articles,num_proceedings,num_books,num_chapters,articles,proceedings,books,chapters,profile,img_url,total_words,quality_tier,email,profile_url
1663,Puan Hamizan binti Sharbini,"Hamizan binti Sharbini received her Bachelor Degree in Information and Communication Technology (ICT) from Universiti Tekonologi Petronas (UTP) Perak, Malaysia, in 2006. She then worked as a tutor in Faculty of Computer Science and Information Technology, Universiti Malaysia Sarawak in 2007. She furthered her study in Master degree majoring in Computer Science in 2009-2010 in Universiti Teknologi Malaysia (UTM), Johor, Malaysia. In 2010, she came back to the faculty and currently worked as lecturer. Her master thesis focused on crowd behavior modelling in panic situation using Social Force Model, with comparison with other existing models such as cellular automata, agent based model etc. Her research interest includes the area of crowd behavior modelling (hybrid model), optimization and artificial intelligent.",57431029400,https://scholar.google.com/citations?user=0qFyArcAAAAJ&hl=en&oi=ao,14,10,0,0,"MRSI: Mobile Road Safety Information Application using Crowdsourcing; Agent-based simulation with awareness levels of the emergency evacuation of educational facilities; NR-Connect: Development of UNIMAS Non-Resident Mobile Application; The Effects of Gamification in Space Exploration Learning.; The Effects of Gamification in Space Exploration Learning.; Revolutionizing crowd safety: A breakthrough hybrid whale-bat chaotic algorithm (WOABCM) for optimized evacuation simulations; Crowd evacuation simulation model with soft computing optimization techniques: a systematic literature review; Crowd Evacuation Behaviour Modeling and Simulation in 3D Platform; An Enhancement of Dyslexic Mobile Application using Sight Word Reading Strategy: Results and Findings; Understanding Technology Changes for ICT4D Projects through Modelling; Dzulkafli, M.S.H., Sharbini, H., Borhan, N.H, Bujang, Y.R. (2016). The Cyberethics Issues: Factors and Impact of Internet Scamming among Undergraduate Students. IOSR Journal of Computer Engineering (IOSRJCE) -(Vol.18, No-6).; Sharbini, H., Borhan, N.H, Chiu, P.C. (2015). Android Mobile Application for Learning Bahasa Melayu (Malay Language) for Primary Students. International Journal of Emerging Technology and Research (Vol.2-16), Impact Factor:0.997.; Developing Reading Skills Using Sight Word Reading Strategy through Interactive Mobile Game-Based Learning for Dyslexic Children; Modification of crowd behaviour modelling under microscopic level in panic situation",Pantun Bermukun Sarawak: Automated Pantun Reply Generation using Fuzzy N-gram Similarity; ClassEscape: The Conceptual Design of Crowd Modeling in Fire Evacuation Simulation; The Hybrid of WOABAT-IFDO Optimization Algorithm and Its Application in Crowd Evacuation Simulation; Optimizing the Social Force Model Using New Hybrid WOABAT-IFDO in Crowd Evacuation in Panic Situation; Optimizing the Social Force Model Using New Hybrid WOABAT-IFDO in Crowd Evacuation in Panic Situation; Crowd Emergency Evacuation Simulation Time Analysis via Obstacle Optimization Strategy; The Analysis of 2D Crowd Behaviour Simulation during Emergency Situation; DESIGNING A MOBILE APPLICATION TESTING MODEL; Analysis of Crowd Behaviour Theories in Panic Situation; Status of HCI Courses Offered by Universities in Malaysia,,,"Hamizan binti Sharbini received her Bachelor Degree in Information and Communication Technology (ICT) from Universiti Tekonologi Petronas (UTP) Perak, Malaysia, in 2006. She then worked as a tutor in Faculty of Computer Science and Information Technology, Universiti Malaysia Sarawak in 2007. She furthered her study in Master degree majoring in Computer Science in 2009-2010 in Universiti Teknologi Malaysia (UTM), Johor, Malaysia. In 2010, she came back to the faculty and currently worked as lecturer. Her master thesis focused on crowd behavior modelling in panic situation using Social Force Model, with comparison with other existing models such as cellular automata, agent based model etc. Her research interest includes the area of crowd behavior modelling (hybrid model), optimization and artificial intelligent. Hamizan binti Sharbini received her Bachelor Degree in Information and Communication Technology (ICT) from Universiti Tekonologi Petronas (UTP) Perak, Malaysia, in 2006. She then worked as a tutor in Faculty of Computer Science and Information Technology, Universiti Malaysia Sarawak in 2007. She furthered her study in Master degree majoring in Computer Science in 2009-2010 in Universiti Teknologi Malaysia (UTM), Johor, Malaysia. In 2010, she came back to the faculty and currently worked as lecturer. Her master thesis focused on crowd behavior modelling in panic situation using Social Force Model, with comparison with other existing models such as cellular automata, agent based model etc. Her research interest includes the area of crowd behavior modelling (hybrid model), optimization and artificial intelligent. MRSI: Mobile Road Safety Information Application using Crowdsourcing; Agent-based simulation with awareness levels of the emergency evacuation of educational facilities; NR-Connect: Development of UNIMAS Non-Resident Mobile Application; The Effects of Gamification in Space Exploration Learning.; The Effects of Gamification in Space Exploration Learning.; Revolutionizing crowd safety: A breakthrough hybrid whale-bat chaotic algorithm (WOABCM) for optimized evacuation simulations; Crowd evacuation simulation model with soft computing optimization techniques: a systematic literature review; Crowd Pantun Bermukun Sarawak: Automated Pantun Reply Generation using Fuzzy N-gram Similarity; ClassEscape: The Conceptual Design of Crowd Modeling in Fire Evacuation Simulation; The Hybrid of WOABAT-IFDO Optimization Algorithm and Its Application in Crowd Evacuation Simulation; Optimizing the Social Force Model Using New Hybrid WOABAT-IFDO in Crowd Evacuation in Panic Situation; Optimizing the Social Force Model Using New Hybrid WOABAT-IFDO in Crowd Evacuation in Panic Situation; Crowd Emergency Evacuation Simulation Time Analysis via Obstacle Optimization Strategy; The Analysis of 2D Crowd Behavi",https://directory.unimas.my/assets/images/staffpic/1663.jpg,390,MODERATE,shamizan@unimas.my,https://expert.unimas.my/profile/1663
315,Puan Inson Binti Din,"Inson Din is an Information Systems lecturer in the Faculty of Computer Science and Information Technology, UNIMAS since 1997. Her areas of specialization are Database Design and Digital Marketing. She has served as a lecturer for more than 20 years and she realize that educating and teaching are her passion.  Be able to see the relieved and happy faces after they were so confused in understanding certain concepts such as normalization in Database subject really satisfy her. She also has embarked more in the projects that serve community especially in Digital Marketing. She is a Digital Marketing Certified Trainer  and really love to share her knowledge with the community in Sarawak or throughout Malaysia.",,https://scholar.google.com/citations?hl=en&pli=1&user=e7EMypsAAAAJ,1,0,0,0,Analysis of nine instance-based genetic algorithm classifiers using small datasets,,,,"Inson Din is an Information Systems lecturer in the Faculty of Computer Science and Information Technology, UNIMAS since 1997. Her areas of specialization are Database Design and Digital Marketing. She has served as a lecturer for more than 20 years and she realize that educating and teaching are her passion. Be able to see the relieved and happy faces after they were so confused in understanding certain concepts such as normalization in Database subject really satisfy her. She also has embarked more in the projects that serve community especially in Digital Marketing. She is a Digital Marketing Certified Trainer and really love to share her knowledge with the community in Sarawak or throughout Malaysia. Inson Din is an Information Systems lecturer in the Faculty of Computer Science and Information Technology, UNIMAS since 1997. Her areas of specialization are Database Design and Digital Marketing. She has served as a lecturer for more than 20 years and she realize that educating and teaching are her passion. Be able to see the relieved and happy faces after they were so confused in understanding certain concepts such as normalization in Database subject really satisfy her. She also has embarked more in the projects that serve community especially in Digital Marketing. She is a Digital Marketing Certified Trainer and really love to share her knowledge with the community in Sarawak or throughout Malaysia. Analysis of nine instance-based genetic algorithm classifiers using small datasets",https://directory.unimas.my/assets/images/staffpic/315.jpg,238,MODERATE,chone@unimas.my,https://expert.unimas.my/profile/315
2157,Dr Izzatul Nabila bt Sarbini,Izzatul Nabila is working as a lecturer at  Universiti Malaysia Sarawak (UNIMAS). She received her PhD degree in Applied Mathematics from Universiti Putra Malaysia (UPM) in 2020.,57188760148,https://scholar.google.com/citations?user=IS0py2kAAAAJ&hl=en,11,3,0,0,"Enhancing Wearable-Based Human Activity Recognition with Binary Nature-Inspired Optimization Algorithms for Feature Selection; Sensitivity Analysis of COVID-19 Transmission Dynamics in Pakistan Using Mathematical Modelling; EDUCATION AND INEQUALITY IN THE ERA OF GLOBALISATION: COMPARATIVE POLICY INSIGHTS FROM TEN NATIONS; Quick Respond-Based Case Note Management System: A Case Study for File Record Unit; The security analysis of GCD attack on LUCELG, LUC(3)ELG and LUC(4,6)ELG; An attack on ELG-LUC3-ECC cryptosystem using Hastad’s and Julta’s theorem; Security Analysis on LUC-type Cryptosystems Using Common Modulus Attack; Data Analytics Approach for Short-term Sales Forecasts Using Limited Information in E-commerce Marketplace; An analysis for chosen plaintext attack in elliptic curve cryptosystem based on second order lucas sequence; Cryptographic attack on luc-type cryptosystems using gmitm (Type 1); Simulation of 2D Saint-Venant equations in open channel by using MATLAB",Wearable Sensor Feature Fusion for Human Activity Recognition (HAR): A Proposed Classification Framework; A Lightweight Multifactor Authentication Scheme for Wireless Sensor Networks in the Internet of Things.; Simulation of 2D surface flow in open channel using explicit finite difference method,,,"Izzatul Nabila is working as a lecturer at Universiti Malaysia Sarawak (UNIMAS). She received her PhD degree in Applied Mathematics from Universiti Putra Malaysia (UPM) in 2020. Izzatul Nabila is working as a lecturer at Universiti Malaysia Sarawak (UNIMAS). She received her PhD degree in Applied Mathematics from Universiti Putra Malaysia (UPM) in 2020. Enhancing Wearable-Based Human Activity Recognition with Binary Nature-Inspired Optimization Algorithms for Feature Selection; Sensitivity Analysis of COVID-19 Transmission Dynamics in Pakistan Using Mathematical Modelling; EDUCATION AND INEQUALITY IN THE ERA OF GLOBALISATION: COMPARATIVE POLICY INSIGHTS FROM TEN NATIONS; Quick Respond-Based Case Note Management System: A Case Study for File Record Unit; The security analysis of GCD attack on LUCELG, LUC(3)ELG and LUC(4,6)ELG; An attack on ELG-LUC3-ECC cryptosystem using Hastad’s and Julta’s theorem; Security Analysis on LUC-type Cryptosystems Wearable Sensor Feature Fusion for Human Activity Recognition (HAR): A Proposed Classification Framework; A Lightweight Multifactor Authentication Scheme for Wireless Sensor Networks in the Internet of Things.; Simulation of 2D surface flow in open channel using explicit finite difference method",https://directory.unimas.my/assets/images/staffpic/2157.jpg,171,SPARSE,sinabila@unimas.my,https://expert.unimas.my/profile/2157
684,Profesor Madya Dr. Jacey Lynn Minoi,"Jacey-Lynn Minoi is a computer scientist, currently working at Universiti Malaysia Sarawak, where she is Lecturer of Computing and Exploratory Data Analysis. Her research focusses on the exploratory of the multivariate tensor-based and multivariate statistical shape analysis algorithms for shape modelling across multiple dimensions and for pattern recognition in fields of face analysis, face recognition and image processing applications. She heads the Biometric and Imaging group and Gamification group, whereby she is the driving force behind the computational  and exploratory thinking using gameful approach for building problem solving skills. Dr Minoi also often travel into the interiors of Sarawak, meeting and staying with the indigenous communities and empowering them with skills needed in her various projects on health informatics, aerial mapping using drones, fun learning, frugal innovation for climate change and community empowerment. These work have been made to national and international media attention.",23035464200,https://scholar.google.com.my/citations?user=kacp5HwAAAAJ&hl=en,27,34,0,1,"Empathic and Agentic Approaches to Community-Engaged Research Scholarship: A Playful, Frugal, and Co-Creative Framework Through the ACES Project in Southeast Asia; Validating the Malay Version of Adolescent Sexual and Reproductive Health Knowledge and Attitudes Questionnaires; Development and validation of a gamified sexual and reproductive health education module for adolescent boys in Malaysia; Digital Advocacy Strategies with Data Analytics Framework: A Case Study for Effective Campaigns; Parent-Adolescent Communication on Sexual and Reproductive Health Issues : A Bibliometric Analysis; Playful and frugal learning design: A value-based approach to inclusive and sustainable STEM education; A Validation Study: Evaluating the Impact of Gameful Experience on Sexual and Reproductive Health Education amongst Adolescent Boys; Performance Evaluation of SIFT Against Common Image
Deformations on Iban Plaited Mat Motif Images; Towards the mapping of learning, playful, and frugal aspects for developing 21st century competencies and resilience; Nudge Theory and Social Innovation : An analysis of citizen and government initiatives during Covid-19 outbreak in Malaysia; Art-Integration in Computational Thinking as an Unplugged Pedagogical Approach at A Rural Sarawak Primary School; Neutral expression synthesis using kernel active shape model; Contextualising Computational Thinking: A Case Study in Remote Rural Sarawak Borneo; Assessing Fun and Engagement in Mobile Applications for Children with Speech Delay; A Participatory Co-Creation Model to Drive Community Engagement in Rural Indigenous Schools: A Case Study in Sarawak; Game-based learning to teach Higher Order thinking in rural Schools: Case studies in Sarawak Borneo; 3D Facial Action Units Recognition for Emotional Expression; Bridging the rural divide in STEM Education through culture, design thinking & gamification in Malaysia; Face perception using tensor approach; Engaging Primary Schools in Rural Malaysia With Game-Based
Learning: Culture, Pedagogy, Technology; Case Study: Game Design Thinking as a Strategy for Community Engagement in a Rural Indigenous Village; A comparative analysis of feature detection and matching algorithms for aerial image stitching; Measuring Usability of Phonic Mobile Applications based on User Success Rate for Pre-School Children; Game Usability Heuristics Evaluation Approach for Speech Therapy Mobile Application Games; Speech Therapy Mobile Application for Speech and Language Impairment Children; Feature extraction and localisation on 2.5D face range images; Remote Patient’s Health Monitoring System for Rural Population: Challenges and Opportunities","Website-based parking information system design as an effort to elevate the management of regional levies; Pre-processing Technique using Colour-based Feature Method to Detect Categories of Leaves Disease; Of Marbles and Minecraft: Designing STEM Educational Games for Culturally Diverse Young Learners in Malaysia; Learning Programming using Lego Mindstorm: Analysis of Learner Experiences; Learning Programming using Lego Mindstorms: Analysis of Learner Experiences; A Non-template Based Automatic Landmarking on 3D Face Data; CreativeCulture: Can Teachers be Game Designers?; The Efficiency of Game-Based Learning Towards Students Focus And Enjoyment Using Board Game : A Case Studyat SK Martin.; CreativeCulture : Learning Through Play; 3D Face Recognition using Kernel-based PCA Approach; Multiway analysis for face recognition; Keypoint Descriptors in SIFT and SURF for Face Feature Extractions; Co-creativity assessment in the process of game creation; Pre-School Children With Speech Delay: Case Control Study Based on Guidelines for Game Designs; Engaging primary schools in rural malaysia with game-based learning: Culture, pedagogy, technology; Mobile Vision-based Automatic Counting of Bacteria Colonies; A watermarking technique to improve the security level in face recognition systems: An experiment with Principal Component Analysis (PCA) for face recognition and Discrete Cosine Transform (DCT) for watermarking; Unsupervised segmentation of action segments in egocentric videos using gaze; 2.5D face landmarking via scale-invariant feature extraction and centroid localization; Automatic landmarking on 2.5D face range images; Grassroots Aerial Mapping Using Unmanned Aerial Vehicle; A holistic ecosystem for rural mHealth applications and lesson learnt; Remote health monitoring system in a rural population: Challenges and opportunities.; Feature extraction and localisation using scale-invariant feature transform on 2.5D image; Synthesizing Neutral Facial Expression on 3D Faces using Active Shape Models; Low Cost Aerial Photography for Sustainable Campus Planning; Automatic generation of fill-in clues and answers from raw texts for crosswords; 3D Facial expression synthesis: A survey; Facial expressions reconstruction of 3D faces based on real human data; Tensor-based multivariate statistical discriminant methods for face applications; Story-telling and narrative methods with localised content to preserve knowledge; Realistic facial expression synthesis of 3D human face based on real data using multivariate tensor methods; Synthesizing 3D Face Shapes Using Tensor-Based Multivariate Statistical Discriminant Methods; A tensor-based multivariate statistical model for 3D face and facial expression recognition",,Statistical analysis of facial expression on 3D face shapes,"Jacey-Lynn Minoi is a computer scientist, currently working at Universiti Malaysia Sarawak, where she is Lecturer of Computing and Exploratory Data Analysis. Her research focusses on the exploratory of the multivariate tensor-based and multivariate statistical shape analysis algorithms for shape modelling across multiple dimensions and for pattern recognition in fields of face analysis, face recognition and image processing applications. She heads the Biometric and Imaging group and Gamification group, whereby she is the driving force behind the computational and exploratory thinking using gameful approach for building problem solving skills. Dr Minoi also often travel into the interiors of Sarawak, meeting and staying with the indigenous communities and empowering them with skills needed in her various projects on health informatics, aerial mapping using drones, fun learning, frugal innovation for climate change and community empowerment. These work have been made to national and international media attention. Jacey-Lynn Minoi is a computer scientist, currently working at Universiti Malaysia Sarawak, where she is Lecturer of Computing and Exploratory Data Analysis. Her research focusses on the exploratory of the multivariate tensor-based and multivariate statistical shape analysis algorithms for shape modelling across multiple dimensions and for pattern recognition in fields of face analysis, face recognition and image processing applications. She heads the Biometric and Imaging group and Gamification group, whereby she is the driving force behind the computational and exploratory thinking using gameful approach for building problem solving skills. Dr Minoi also often travel into the interiors of Sarawak, meeting and staying with the indigenous communities and empowering them with skills needed in her various projects on health informatics, aerial mapping using drones, fun learning, frugal innovation for climate change and community empowerment. These work have been made to national and international media attention. Empathic and Agentic Approaches to Community-Engaged Research Scholarship: A Playful, Frugal, and Co-Creative Framework Through the ACES Project in Southeast Asia; Validating the Malay Version of Adolescent Sexual and Reproductive Health Knowledge and Attitudes Questionnaires; Development and validation of a gamified sexual and reproductive health education module for adolescent boys in Malaysia; Digital Advocacy Strategies with Data Analytics Framework: A Case Study for Effective Campaigns; Parent-Adolescent Communication on Sexual and Reproductive Health Issues : A Bibliometric Analysis; Pla Website-based parking information system design as an effort to elevate the management of regional levies; Pre-processing Technique using Colour-based Feature Method to Detect Categories of Leaves Disease; Of Marbles and Minecraft: Designing STEM Educational Games for Culturally Diverse Young Learners in Malaysia; Learning Programming using Lego Mindstorm: Analysis of Learner Experiences; Learning Programming using Lego Mindstorms: Analysis of Learner Experiences; A Non-template Based Automatic Landmarking on 3D Face Data; CreativeCulture: Can Teachers be Game Designers?; The Efficiency of Gam",https://directory.unimas.my/assets/images/staffpic/684.jpg,445,RICH,jacey@unimas.my,https://expert.unimas.my/profile/684
